"Authors","Author full names","Author(s) ID","Title","Year","Source title","Volume","Issue","Art. No.","Page start","Page end","Cited by","DOI","Link","Abstract","Document Type","Publication Stage","Open Access","Source","EID"
"George T.; Balaji B.S.; Paul R.; Verma S.; Moorthy V.; Sengodan G.; Srinivasan S.; George P.; Pandey A.; Pushpalatha M.","George, Tom (60498200300); Balaji, Brahmika Shree (60497563900); Paul, Rounak (60497874600); Verma, Saumya (60497405900); Moorthy, Vaishnavi (57193098786); Sengodan, Gomathi (57468834000); Srinivasan, Sundar (57200931410); George, Praveen (57195533807); Pandey, Ankit (60497510900); Pushpalatha, M. (35146619400)","60498200300; 60497563900; 60497874600; 60497405900; 57193098786; 57468834000; 57200931410; 57195533807; 60497510900; 35146619400","A novel method for real-time image synthesis through layered component integration using stable diffusion within a multi-layered large language model","2025","2025 IEEE International Conference on Electronics, Computing and Communication Technologies, CONECCT 2025","","","","","","0","10.1109/CONECCT65861.2025.11306736","https://www.scopus.com/inward/record.uri?eid=2-s2.0-105032673291&doi=10.1109%2FCONECCT65861.2025.11306736&partnerID=40&md5=5b64c314efbd8ae8cc802599963b6c13","Advertising is a crucial factor in increasing product sales, requiring expert skills and significant effort to design effective promotional materials. With the growing prevalence of generative AI, the process of creating promotional posters is being automated. Generative AI revolutionizes advertising by ensuring brand consistency through the alignment of visuals, colors, and text with a company's identity. It facilitates the rapid production of high-quality posters, minimizing the need for manual effort and professional designers. By analyzing successful campaigns, AI generates designs that evoke the appropriate emotions, enhancing customer engagement. Additionally, it enables personalization by producing customized posters for different audiences and regions. Leveraging real-time data, AI optimizes designs for maximum impact, leading to greater cost efficiency and scalability, allowing brands to create visually compelling materials quickly and affordably. The proposed approach generates backgrounds using a multiple-masking strategy, incorporating a base color along with slightly lighter and darker variations. These shades are blended using a high-value blur to create a smooth gradient. The layout operates on default parameters, which can be customized by administrators. A Large Language Model (LLM) selects the background color scheme, applying color theory and generating recommendations based on contextual requirements. To enhance the advertisement's tone, a foreground element generator produces complementary design components. Each attribute - background, foreground, and text-is generated independently and integrated using Python libraries and functions to produce a finalized marketing asset. The model's effectiveness is validated through multiple human evaluation rounds, demonstrating its ability to meet design requirements while preserving originality and aesthetics. By automating ad creation, this approach reduces time and resource costs while ensuring professional-quality marketing materials. It enhances scalability, enabling businesses to create diverse, platform-specific ads with real-time customization. Ideal for seasonal promotions and localized campaigns, it ensures brand consistency while improving efficiency, engagement, and conversion rates, ultimately transforming digital advertising strategies. © 2025 IEEE.","Conference paper","Final","","Scopus","2-s2.0-105032673291"
"Ghag A.; Bavishi B.; Choudhary N.; Munshi A.","Ghag, Aum (59738942700); Bavishi, Bhavya (59739352100); Choudhary, Nehaal (59739453100); Munshi, Ami (56770853400)","59738942700; 59739352100; 59739453100; 56770853400","Revolutionizing Education with PersonifAI: A Deep Dive into AI-Driven Personalized Learning","2025","2025 IEEE International Students' Conference on Electrical, Electronics and Computer Science, SCEECS 2025","","","","","","0","10.1109/SCEECS64059.2025.10940280","https://www.scopus.com/inward/record.uri?eid=2-s2.0-105002713674&doi=10.1109%2FSCEECS64059.2025.10940280&partnerID=40&md5=33ec5af3854bacc551de89ed2094c0a0","This paper presents PersonifAI. An education platform, for students powered by artificial intelligence to develop skills in high demand areas such as project management digital marketing and data analysis After an initial evaluation to identify users strengths and weaknesses the platform uses a customized Llama 3.1(8 billion) model to provide personalized audiobooks textbooks curriculum materials and quizzes Through the use of Retrieval Augmented Generation (RAG) PersonifAI guarantees that the content is relevant individualized and responsive, to each user's needsThe study details how artificial intelligence (AI) is set to revolutionize the field of education by offering perspectives on personalized learning in the years and showcases PersonifAI as a prime illustration of AI driven educational advancements. © 2025 IEEE.","Conference paper","Final","","Scopus","2-s2.0-105002713674"
"Wang T.; Yang F.; Wang Y.; Liu Z.; Cai J.","Wang, Tianqi (59526644600); Yang, Fengyuan (59539868500); Wang, Yu (59539528900); Liu, Zhiyu (59540029600); Cai, Jiucheng (59539529000)","59526644600; 59539868500; 59539528900; 59540029600; 59539529000","AI in Customer Relationship Management: A comprehensive review of AI applications for personalized marketing, customer segmentation, and churn prediction","2024","ACM International Conference Proceeding Series","","","","317","320","0","10.1145/3691422.3691474","https://www.scopus.com/inward/record.uri?eid=2-s2.0-85216782139&doi=10.1145%2F3691422.3691474&partnerID=40&md5=53637ad06813844f60e2ea7774ccfbd3","In today’s competitive market, understanding customer relationships is crucial for businesses to meet diverse consumer demands effectively. This study investigates the significance of user segmentation, a process vital for comprehending customer characteristics and needs. Adapting various factors such as demographics, behavior patterns, and psychological traits, enterprises can dissect large user groups into smaller, targeted subgroups, allowing for tailored products, services, and marketing strategies. While traditional methods often rely on simplistic demographic or behavioral data, the incorporation of artificial intelligence offers a more subtle approach. However, businesses face challenges in accurately segmenting customers and ensuring privacy protection. This thesis aims to explore AI applications in personalized marketing, customer segmentation, and churn prediction, addressing existing challenges and proposing unique solutions. By reviewing current AI-driven models such as RFM analysis, Cohort analysis, and Cluster analysis, this study seeks to bridge the gap between theory and practice, offering insights into the evolving landscape of AI in customer relationships. Our literature review offers unique solution of AI driven system in customer segmentation on how to protect detailed information as well as explicitly analyse personal habits when the sample variables are too complex and deeply investigates how enterprises adapt customer relationship skills in daily affairs. © 2024 Copyright held by the owner/author(s).","Conference paper","Final","","Scopus","2-s2.0-85216782139"
"Reddy S.M.; Jyothi G.; Azhar M.","Reddy, Seelam Manaswini (59451913700); Jyothi, Gudivada (59450901100); Azhar, Mohd (57423333200)","59451913700; 59450901100; 57423333200","Embracing Digital Transformation: A New Era for Wholesale and Retail Marketing","2024","Reshaping Marketing Science in Wholesaling and Retailing","","","","1","18","0","10.4018/979-8-3693-6145-0.ch001","https://www.scopus.com/inward/record.uri?eid=2-s2.0-85210667784&doi=10.4018%2F979-8-3693-6145-0.ch001&partnerID=40&md5=a65eeabe80fe91b8ff250f144e2d7d88","This chapter highlights digital marketing with special reference to wholesalers and retailers marketing specifically moving from website or email marketing to advanced marketing using artificial intelligence. They also discuss how such new technologies as AI, data analytics can be applied in a community. of electronic commerce has also impacted customer relations and business activities in a remarkable manner. From the analyzed text, one can conclude that the current trends are in omnichannel marketing, personalization, augmented reality, and virtual reality technologies. It ensures the transfer of information and skills on matters: data security, privacy concerns, organizational cultural transformation, among others. The chapter also illustrates how the following can be applied as a way of competitiveness improvement. This includes predictive analytics, artificial in inventory and supply chain, and digital identity. The curriculum also emphasizes the idea that marketing cannot be unethical, and that the notion of sustainability has to be discussed in the context of Internet age. © 2024 by IGI Global. All rights reserved.","Book chapter","Final","","Scopus","2-s2.0-85210667784"
"Tiwari P.A.; Khang A.","Tiwari, Pankaj A. (59813246300); Khang, Alex (58556605100)","59813246300; 58556605100","Influence of Artificial Intelligence Competencies on Business Value: B2B Marketing Capabilities Context","2024","Revolutionizing the AI-Digital Landscape: A Guide to Sustainable Emerging Technologies for Marketing Professionals","","","","116","128","0","10.4324/9781032688305-8","https://www.scopus.com/inward/record.uri?eid=2-s2.0-85193420439&doi=10.4324%2F9781032688305-8&partnerID=40&md5=2de80612f04997071f874dfd8b8a479e","The deployment of artificial intelligence (AI) has been spreading in different domains in recent times, with much emphasis on its prospective considering business-to-business (B2B) marketing. Initial research highlights the advantages of artificial intelligence, for instance providing critical insights about individual actions, recognizing the required understanding of the marketplace, and rationalizing day-to-day business inadequacies. However, a research gap is observed relating to the ways businesses should shape AI capabilities, and eventually business value is impacted from an organization's perspective. In this chapter, the conceptual framework is developed that investigates the impact of AI competencies on business value considering B2B marketing capabilities. One hundred thirty seven survey responses are used to test the proposed research framework from technology organizations, and the ordinal regression method was used for the statistical analysis. The research outcome highlights the processes via which AI skills impact B2B marketing abilities and how the latter influence business value. © 2024 selection and editorial matter, Alex Khang, Pushan Kumar Dutta, Nishu Aayedee, Sachin Gupta, and Sandeep Chatterjee; individual chapters, the contributors. All rights reserved.","Book chapter","Final","","Scopus","2-s2.0-85193420439"
"Karal Y.","Karal, Yasemin (59755762400)","59755762400","Generative AI Technology and Creativity in Education: Technology and Creativity in Education","2025","Reimagining Curriculum and Assessment in the Age of Generative AI","","","","135","160","0","10.4018/979-8-3373-7579-3.ch005","https://www.scopus.com/inward/record.uri?eid=2-s2.0-105026027656&doi=10.4018%2F979-8-3373-7579-3.ch005&partnerID=40&md5=35c7ddb0c34443e415c3de8336c4c7dd","Creativity has become increasingly important in all fields. The emergence of generative artificial intelligence (GenAI) technology has sparked debate on the idea that this skill can be emulated by machines. GenAI is used in fields such as architecture, graphic design, game design, fashion, art, sports, advertising and marketing, and medicine. Its impact on education is also under intense scrutiny. This chapter explores the GenAI-human collaboration that is transforming creativity in fields ranging from science and technology to education and the arts. The use of GenAI in creative processes in education is discussed in the context of its opportunities and potential limitations. There are discussions on how it redefines ethical issues related to creativity. Furthermore, the implications for copyright and originality are evaluated, and the situation that these technologies create in relation to ownership is discussed. © 2026 by IGI Global Scientific Publishing. All rights reserved.","Book chapter","Final","","Scopus","2-s2.0-105026027656"
"Bushuyev S.; Ivko A.","Bushuyev, Sergiy (6506632335); Ivko, Andrii (58614581700)","6506632335; 58614581700","STUDY OF THE PRINCIPLE OF AUGMENTED COMPETENCY IN THE AUDIT OF IT PROJECTS IN THE ENVIRONMENT OF ARTIFICIAL INTELLIGENCE","2024","Technology Audit and Production Reserves","4","2","","49","53","0","10.15587/2706-5448.2024.310525","https://www.scopus.com/inward/record.uri?eid=2-s2.0-105011839222&doi=10.15587%2F2706-5448.2024.310525&partnerID=40&md5=a158a444b0e3e77e706dd89972d01ec9","The development of artificial intelligence (AI) is revolutionizing various industries, including IT project management. The object of research is the principle of augmented competence, which is a new approach that uses AI to strengthen and expand the capabilities of IT project teams. The essence of this principle lies in the complementary interaction of AI and the competence of project teams. Instead of replacing project managers, AI complements their competencies (knowledge, skills and experience). One of the hot spots is the application of AI in the process of automating routine tasks, analyzing large volumes of data and providing recommendations and predictions, freeing up time for team members to focus on more complex and creative tasks. The possibility of automating tasks and providing new knowledge, which will significantly improve the efficiency and productivity of the team, has been obtained through the use of the principle of augmented competence. As a result, data-driven recommendations and predictions enable teams to make more informed and effective decisions. Access to new knowledge and insights stimulates innovation and leads to new ideas and solutions, helps identify and mitigate potential risks, which can lead to more successful projects. Applying this principle to IT project management audits will automate software testing with AI, which replaces testers so they can focus on more complex types of testing such as exploratory testing, performs customer data analysis with AI, and enables companies to better understand your customers and their needs, which can lead to better marketing campaigns and products. It is important to note that this principle does not involve replacing project managers with AI. Instead, AI is used as a tool to empower human teams and help them achieve better results. As AI technologies continue to evolve, the principle of augmented competence is likely to play an even more important role in IT project management. AI can help teams overcome complex challenges, make better decisions, and succeed in a more dynamic and competitive environment. © The Author(s) 2024.","Article","Final","All Open Access; Gold Open Access","Scopus","2-s2.0-105011839222"
"Emedo C.; Wada O.Z.; Clement David-Olawade A.; Ling J.; Esan D.T.; Ijiwade J.; Olawade D.B.","Emedo, Chinwe (60124962000); Wada, Ojima Z. (57223679195); Clement David-Olawade, Aanuoluwapo (59221941200); Ling, Jonathan (7201776316); Esan, Deborah T. (56958592900); Ijiwade, James (59544789900); Olawade, David B. (57219597340)","60124962000; 57223679195; 59221941200; 7201776316; 56958592900; 59544789900; 57219597340","AI-driven transformations in smart buildings: A review of energy efficiency and sustainable operations","2025","Digital Engineering","7","","100068","","","5","10.1016/j.dte.2025.100068","https://www.scopus.com/inward/record.uri?eid=2-s2.0-105017712740&doi=10.1016%2Fj.dte.2025.100068&partnerID=40&md5=6d7b66fbe773b136ff5861064d68b3d4","This comprehensive review examines the transformative impact of artificial intelligence (AI) technologies on smart buildings and real estate management through a systematic narrative analysis of peer-reviewed articles and industry reports published between 2016–2024. Using a thematic synthesis approach across five primary domains, property valuation, predictive maintenance, tenant screening, marketing and sales, and smart building operations, we investigated AI's role in enhancing energy efficiency and sustainable operations. Key findings reveal that AI-powered systems achieve remarkable performance improvements: valuation accuracy increased from 70 % to 95 %, operational costs reduced by 17.6 %, maintenance costs decreased by 13.2 %, and energy savings reached 14 % while maintaining 91 % resident satisfaction. Our analysis identifies critical implementation barriers including data quality challenges, algorithmic bias risks, substantial upfront investments, and skills gaps. The review reveals that ensemble machine learning techniques achieve 85–100 % accuracy in energy forecasting, while IoT-integrated predictive maintenance systems extend equipment lifespan by 25–30 %. Despite promising benefits, ethical considerations around privacy, transparency, and fairness demand immediate attention. This review contributes novel insights into the economic-environmental nexus of AI adoption, demonstrating that sustainable building operations and profitability are not mutually exclusive but rather synergistic outcomes of intelligent system integration. © 2025 The Authors","Review","Final","All Open Access; Gold Open Access; Green Open Access","Scopus","2-s2.0-105017712740"
"Fortino A.","Fortino, Andres (57211792485)","57211792485","Data analysis for business decisions: Case studies in excel, R, and ChatGPT: Third edition","2025","Data Analysis for Business Decisions: Case Studies in Excel, R, and ChatGPT: Third Edition","","","","1","426","0","10.1515/9781683929338","https://www.scopus.com/inward/record.uri?eid=2-s2.0-86000232875&doi=10.1515%2F9781683929338&partnerID=40&md5=e1121335f124b25ba161e8998a445041","In today's data-driven world, the ability to analyze and interpret data is no longer optional-it's a necessity for making informed business decisions. This book provides a comprehensive, hands-on guide to mastering the essential techniques and tools that empower business analysts to transform raw data into actionable insights. Packed with practical exercises and real-world case studies, this book focuses on applying statistical methods across the most widely used tools, including Excel, R, Python, and generative AI platforms like ChatGPT. Key topics include framing analytical questions, descriptive and advanced statistical techniques, text analytics and A/B testing, and big data and visualization. Whether analyzing sales trends, optimizing marketing strategies, or improving operational efficiency, you'll gain the skills to make data-backed decisions that drive business success. FEATURES Includes hands-on exercises with industry-standard tools, including Excel, R, Python, and generative AI Covers step-by-step instructions for advanced techniques like time series forecasting and contingency analysis Uses real-world case studies to demonstrate the application of concepts to business scenarios Features companion files with datasets, surveys, and cases (available for downloading from the publisher). © 2025 by Mercury Learning and Information. All rights reserved.","Book","Final","","Scopus","2-s2.0-86000232875"
"Tsakalerou M.; Tynybayeva N.; Abil A.","Tsakalerou, Mariza (56705376500); Tynybayeva, Narkes (59963834600); Abil, Akmaral (57192387788)","56705376500; 59963834600; 57192387788","Bridging Minds and Machines: Emotional Intelligence as Intellectual Capital for Human-AI Collaboration","2025","Proceedings of the European Conference on Knowledge Management, ECKM","2","","","1042","1050","1","10.34190/eckm.26.2.4006","https://www.scopus.com/inward/record.uri?eid=2-s2.0-105020567255&doi=10.34190%2Feckm.26.2.4006&partnerID=40&md5=6beac9b91b19543d2b37b2f74cb81b60","As AI evolves from a tool to a key collaborator and co-creator across industries, its effectiveness is influenced by humans' abilities to guide, interpret, and refine AI-generated outputs. This study examines how self-awareness, emotional regulation, empathy, adaptability, emotional expression, and interpersonal skills- the core emotional intelligence competencies- moderate human-AI collaboration for creative problem-solving. The research positions emotional intelligence within the intellectual capital framework as a dimension of human capital that enhances both individual performance and organizational capital. Through empirical research with marketing professionals, the study ranks emotional intelligence competencies based on how they improve AI-generated creative outputs. The findings reveal that emotional expression is the most effective competency for enhancing creative outcomes, while adaptability shows negligible influence. This evidence suggests that professionals who can communicate emotional context effectively generate more innovative AI responses than those who focus solely on technical parameters. The study further examines professionals' specific interaction strategies, comparing emotionally informed prompt engineering, iterative refinement, and role-based interaction approaches. The results indicate that prompt clarity consistently ranks as the most effective strategy for enhancing AI responses, while emotional context remains significantly underutilized despite empirical evidence supporting its benefits. This gap between research findings and current professional practice highlights an important opportunity for targeted emotional intelligence development within organizations adopting AI technologies. Indeed, while the emotional context of human-AI interaction remains underutilized despite its proven benefits, organizations that invest in emotional intelligence competencies can achieve improved technological integration, effectively connecting human creativity with AI capabilities. The research presents a structured framework for developing these competencies, with a particular emphasis on emotional expression and contextual prompting techniques. These findings carry significant implications for businesses creating AI implementation strategies, educators designing curricula for future professionals, and policymakers setting guidelines for responsible AI adoption, all while aiming to enhance AI-driven creativity without sacrificing human-centered innovation principles. © 2025 Academic Conferences Limited. All rights reserved.","Conference paper","Final","All Open Access; Gold Open Access","Scopus","2-s2.0-105020567255"
"Nakyejwe S.L.K.; Nassali S.; Walulumba S.; Nabaggala N.K.; Ninsiima E.; Apio J.J.","Nakyejwe, Saadat Lubowa Kimuli (59723593200); Nassali, Sarah (60347598200); Walulumba, Samuel (60233035100); Nabaggala, Nashua Kimuli (59722984800); Ninsiima, Eunice (60233620900); Apio, Juliet Joy (58104639200)","59723593200; 60347598200; 60233035100; 59722984800; 60233620900; 58104639200","Preparing Ugandan University Students for the AI-Driven Gig Economy: Advancing Decent Work for All Through Education","2026","Lecture Notes in Networks and Systems","1702 LNNS","","","3","14","0","10.1007/978-3-032-09908-2_1","https://www.scopus.com/inward/record.uri?eid=2-s2.0-105028351756&doi=10.1007%2F978-3-032-09908-2_1&partnerID=40&md5=a45866ae360713a26e9feb149b0b80ec","This study aimed to evaluate the preparedness of Ugandan university students for the AI-driven gig economy as a means to advance decent work opportunities. A mixed-methods approach was employed, incorporating a survey of 250 students and semi-structured interviews with 20 university staff from five major Ugandan universities, selected through purposive sampling. Study findings indicate that while foundational business and marketing skills are relatively well-integrated into the curricula, significant deficiencies exist in providing AI-specific training and digital skills development. Only 30% of respondents agreed that their programs adequately cover AI competencies, and merely 35% perceived that lecturers possess sufficient training in digital technologies. Moreover, infrastructural challenges further impede practical learning. Notably, students with prior gig economy experience exhibited higher confidence levels in transitioning to AI-driven freelance work than their counterparts. The study highlights the urgent need for curricula reforms, enhanced faculty development programs, and strategic investments in digital infrastructure to better align academic offerings with industry demands. This study contributes valuable insights for policymakers and educational institutions aiming to foster a digitally competent workforce and recommends further research into the long-term impacts of these interventions on graduate employability and economic growth. © The Author(s), under exclusive license to Springer Nature Switzerland AG 2026.","Conference paper","Final","","Scopus","2-s2.0-105028351756"
