"Authors","Author full names","Author(s) ID","Title","Year","Source title","Volume","Issue","Art. No.","Page start","Page end","Cited by","DOI","Link","Abstract","Document Type","Publication Stage","Open Access","Source","EID"
"Chuan-Fu W.; Kuppusamy M.","Chuan-Fu, Wang (59736111100); Kuppusamy, Mudiarasan (8918511100)","59736111100; 8918511100","Adoption of AI marketing by small and medium enterprises in Malaysia: examining the success factors","2025","Recent Research in Management, Accounting and Economics (RRMAE): A Case Study on Recent Research in Management, Accounting and Economics","","","","659","663","0","10.4324/9781003606642-145","https://www.scopus.com/inward/record.uri?eid=2-s2.0-105002542859&doi=10.4324%2F9781003606642-145&partnerID=40&md5=4f03174c622a9f415719c3a5adcd3644","In exploring artificial intelligence (AI)-driven marketing for small and medium enterprises (SMEs) in Malaysia, the study delves into crucial success factors such as CSF adoption, effective communication, individual skills, SMEs privacy, and technological infrastructure. Employing a partial least squares structural equation modeling (PLS-SEM) model and a quantitative research methodology with a sample of 380 stakeholders, including small business managers and enterprise owners, the survey uncovers significant potential and relationships among these critical factors. The evolving landscape of small businesses and marketing trends highlights the importance of equal attention to each CSF for successful AI adoption in Malaysia. The findings suggest a promising avenue for SMEs in leveraging AI for marketing, emphasizing the need for continued research into these critical success factors to further advance AI adoption in the Malaysian business landscape. © 2025 selection and editorial matter, Hafinaz, Hariharan R and R. Senthil Kumar.","Book chapter","Final","","Scopus","2-s2.0-105002542859"
"Bruen J.E.; Jung S.; Jeon M.","Bruen, Jacqueline Elise (58453537000); Jung, Sumin (60285546900); Jeon, Myounghoon (59929674600)","58453537000; 60285546900; 59929674600","Knowledge of How AI Art is Made Shapes Audience’s Valuations of a Technologically Augmented Live Dance Performance","2025","International Journal of Human-Computer Interaction","","","","","","0","10.1080/10447318.2025.2595546","https://www.scopus.com/inward/record.uri?eid=2-s2.0-105026813951&doi=10.1080%2F10447318.2025.2595546&partnerID=40&md5=0b2941839aefb0fff16275979b234ea5","Artworks aided by generative artificial intelligence (GenAI) have mixed reception. In the present work we design a study to learn how people perceive artistic contributions made by GenAI. We developed two technologically augmented dance performances, one with GenAI and one without. We ran each performance twice: we either told audience members (39 participants, 13 male, 26 female, divided into four audiences) how the performance was made before or after they had seen it and taken a survey on their thoughts. We conducted audience focus groups after each performance, interviewed the dancer, and had the technologist write a reflection. Results from audiences showed that people were more likely to attribute artistic skill to GenAI’s contributions when they weren’t aware of the technology, while interview and written reflection data demonstrated unique methods toward enhancing interdisciplinary collaboration. Results offer nuanced thoughts on the deployment of GenAI art which could aid commercial marketing efforts. © 2025 Taylor & Francis Group, LLC.","Article","Article in press","","Scopus","2-s2.0-105026813951"
"Gahane S.; Dubey A.; Anawade P.; Sharma D.","Gahane, Shailesh (58654491400); Dubey, Aastha (59727928600); Anawade, Pankajkumar (59259557300); Sharma, Deepak (58601890500)","58654491400; 59727928600; 59259557300; 58601890500","The Use of Artificial Intelligence and Predictive Data Analytics Approaches and Techniques in AI-Driven Modern Applications and Sectors","2025","Lecture Notes in Networks and Systems","1194","","","211","220","5","10.1007/978-981-97-9523-9_18","https://www.scopus.com/inward/record.uri?eid=2-s2.0-105002119804&doi=10.1007%2F978-981-97-9523-9_18&partnerID=40&md5=edb256c42332528d83710e0b50cf86cc","This research paper presents the role of data analytics in artificial intelligence. It talks about how data analytics is incorporated in AI. It delves into the realms of data analytics and predictive modelling, elucidating the distinctions between data analytics and data analysis. The process of gathering, organizing, and transforming data in order to produce forecasts and conclusions for well-informed decision-making is known as data analytics. It highlights the transformative role of technology over decades and how predictive analysis aids in modelling future outcomes. Predictive analytics, a focal point of the discussion, involves the use of data to forecast future results. It employs tools, algorithms, and techniques from machine learning, artificial intelligence, and statistical models to anticipate forthcoming trends. The narrative underlines the significance of predictive modelling across diverse industries, including insurance, marketing, finance, sports, and healthcare. It expounds upon supervised and unsupervised predictive models, which, respectively, involve labelled and unlabelled datasets. The integration of artificial intelligence into predictive analytics is a central theme. The fusion of AI and predictive modelling empowers businesses to comprehend customer behaviour, enhance sales, and optimize decision-making processes. Machine learning’s role is highlighted as it enables machines to learn from data and make informed choices. The advantages of AI-driven approaches, such as reduced human error, constant availability, risk mitigation, and innovative breakthroughs, are detailed. The abstract concludes by underscoring the applications of AI-driven data analytics, highlighting how it enables businesses to gain insights, enhance efficiency, predict demand, and ultimately make more informed decisions. These machines can very accurately replicate human skills thanks to technological advancements. The industries that use big data and artificial intelligence (AI) include those that have benefited from the growing demand for smart production that is safe, affordable, and sustainable, as well as from new technical enablers. Finally, through comprehensive studies and conversations, we investigate the importance of AI and the massive towards 4.0 applications. Finally, through comprehensive studies and conversations, we investigate the importance of AI and the future studies in the field are anticipated to use this work as a baseline. The paper provides a comprehensive overview of the role of data analytics in artificial intelligence, covering various techniques and approaches. The inclusion of applications of AI-driven data analytics offers practical insights into its implementation. © The Author(s), under exclusive license to Springer Nature Singapore Pte Ltd. 2025.","Conference paper","Final","","Scopus","2-s2.0-105002119804"
"Swartout W.R.","Swartout, William R. (6603787940)","6603787940","Virtual humans","2006","Proceedings of the National Conference on Artificial Intelligence","2","","","1543","1545","1","","https://www.scopus.com/inward/record.uri?eid=2-s2.0-33750799301&partnerID=40&md5=8e3186908c7543275db306df866e082f","Imagine a simulated world where the characters you interact with are almost human - they converse with you in English, they understand the world they are in, can reason about what to do, and they exhibit emotions. Some of these characters may be your friends, while others will oppose you. Unlike current video games, being successful in this world won't just be a matter of who is quickest on the draw or most adroit at solving puzzles, instead it will be the person who understands the social fabric and cultural context and can use interpersonal skills most effectively. Such a simulation could open up whole new horizons for education, entertainment and simulation. And, given recent advances in AI and graphics, it may not be too far off. Virtual humans are computer-generated characters that can take the part of humans in a variety of limited contexts. These can include acting as role-players in simulations and training systems (Johnson, Rickel & Lester 2000; Swartout et al. 2005; Traum et al. 2005; Johnson, Vilhjálmsson & Marsella 2005), where they play a variety of parts, such as acting as friendly or hostile forces, or locals in the environment. Other uses for virtual humans include acting as museum guides (Gustafson & Bell 2000), marketing assistants (Cassell, Bickmore et al. 2000) or characters in entertainment systems, where the advent of video games such as The Sims 2 makes clear the growing interest of the computer game industry in virtual humans (see also (Mateas & Stern 2003)). The behaviors of virtual humans are not scripted in advance, but instead they use artificial intelligence to understand what is going on in their simulated world and figure out how to respond. They form and modify their beliefs, plans and emotions, and act and communicate using both natural language and non-verbal gestures. Over the last ten years, virtual human research has made substantial progress, advancing from rather stilted characters with limited interaction capabilities to ones that inter act robustly using a much more fluid repertoire for both verbal and non-verbal communication. In this talk I will give an overview of virtual human research, focusing on the opportunities this area provides and the lessons learned and their larger implications for the field of artificial intelligence. Finally, I will conclude with some thoughts on future directions for virtual human research. Because virtual humans are intended to mimic a broad range of human behaviors, they must integrate a diverse set of AI technologies, including speech recognition, natural language understanding and generation, dialogue management, non-verbal communication, perception, automated reasoning, and emotion modeling. While integrating such a broad range of technologies can be a daunting task, I believe it has several important benefits for AI research. First, in our own work on virtual humans at the ICT, by focusing on the overall behavior of the virtual human and trying to make that behavior believable, we have uncovered research areas that have received relatively little attention up to now. One such area is emotion modeling. Arguably, the great preponderance of AI research over the last 50 years has not been concerned with emotions but rather with building systems that behave intelligently in their environment. Yet, we have found that when people see a virtual human, they not only expect it to behave rationally but also to exhibit appropriate emotions. In fact, people sometimes explain a character's behavior on emotional grounds whether or not the character actually uses emotion models. We thus realized that understanding how to build computer models of emotion was essential if we were to avoid unintentionally misleading behaviors from our virtual humans, which led to a major effort in emotion modeling (Gratch & Marsella 2004). Another area where the study of virtual humans has raised new issues is natural language processing. One issue is that the virtual humans are embedded in a social structure and that affects how language is used. Additionally, while most natural language systems assume a one-on-one interaction between a computer and a user, virtual humans may be involved in multiple conversations about multiple topics simultaneously. In this talk I will describe these new areas of re search and the approach that we and others have taken to address them. A second benefit that emerges from the integration of various AI capabilities in the context of a virtual human is that it makes additional knowledge available that can resolve problems that are difficult to resolve in isolation. For example, we have found that some problems in natural language processing, such as resolving the linguistic focus of an ambiguous question can be done much more successfully by taking advantage of information in a character's emotional model. In the talk I will describe this and other synergies we have found that result from integration. It could be argued that the integration problem posed by virtual humans is daunting. Indeed, if one were to try to build a virtual human that would function in the real world it might well be too difficult: too many possibilities and interactions to consider. But virtual humans are not constructed to function in the real world, instead they operate in a synthetic, simulated world that both people and the virtual humans inhabit. The story or scenario behind that simulation is critical because it establishes a strong context for the experience. This context is important because it limits the range of responses that a person in the simulation is likely to make, which in turn makes it easier to build a virtual human that will function robustly. For example, a person engaged in an emergency medical simulation is unlikely to ask a virtual human about recent baseball scores. In this talk I will elaborate on the relationship between story and virtual humans technology and describe how it can be used not only to limit context but also to deal with impasses in a simulated experience (Mateas & Stern 2003; Swartout, Gratch et al. 2005). Finally, in this talk I will address some new areas in virtual human research, focusing on two areas in particular: Perceptive Virtual Humans. Although some progress has been made (Morency, Sidner et al. 2005) current virtual humans have limited abilities to see the gestures, posture or facial expressions of a person interacting with them and limited ability to hear the prosody in his or her voice. This lack of perception makes it much more difficult for virtual humans to interact in a natural way. Gestures cannot be intermixed with speech and since the virtual human cannot see posture, facial expressions or sense the tone of a person's voice it is much more difficult for the virtual human to gauge a person's emotional state. Research directed toward developing the technology that will make virtual humans perceptive will open up new communication channels between people and virtual humans and could significantly improve interaction.Theory of mind and social reasoning. Current virtual humans have only a limited ability to model their own beliefs, desires and intentions or those of others. This limitation curtails their ability to reason in social situations, negotiate and work as teams. Research in this area could enhance a virtual human's ability to behave plausibly in the complex social environments opening up new applications for entertainment, training and education. By focusing on the problem of mimicking human behavior and intelligence and bringing together a variety of AI research threads into an integrated system, virtual humans research is addressing some of the same problems that participants at the Dartmouth Conference described 50 years ago. Benefiting from far greater processing power, much better software architectures and half a century of progress in the various subareas of AI, it's exciting to think about what the next 50 years may bring. Copyright © 2006, American Association for Artificial Intelligence (www.aaai.org). All rights reserved.","Conference paper","Final","","Scopus","2-s2.0-33750799301"
"Urribarri A.C.; Vera K.C.","Urribarri, Africa Calanchez (57486671700); Vera, Kerwin Chavez (57191906973)","57486671700; 57191906973","Adoption of Disruptive Technologies in Marketing in Latin American Organizations: A Documentary Review","2025","Qubahan Academic Journal","5","4","","703","722","0","10.48161/qaj.v5n4a1956","https://www.scopus.com/inward/record.uri?eid=2-s2.0-105027435939&doi=10.48161%2Fqaj.v5n4a1956&partnerID=40&md5=f899f3a50ba7845a39095b58cca0565b","The study analyzes the impact of disruptive technologies on marketing in Latin American organizations, highlighting their ability to transform business strategies through tools such as Big Data, IoT, artificial intelligence (AI) and machine learning (ML). These technologies make it possible to personalize services, optimize operations and improve interaction with customers in a competitive environment. The main objective was to examine the adoption of these technologies in Latin America, identifying key factors affecting their implementation and proposing strategies to optimize their integration. The methodology employed was qualitative, based on an exhaustive document review following the PRISMA method. Databases such as Scopus and Web of Science (WoS) were used to identify 868 initial documents, from which, after applying inclusion and exclusion criteria, 24 relevant studies were selected. In addition, grounded theory was used to analyze the data, categorizing them by means of open, axial and selective coding, which made it possible to identify patterns, trends and gaps in the literature. The main result reveals that, although disruptive technologies offer great opportunities, their implementation in Latin America faces significant challenges, such as socioeconomic inequality, poor technological infrastructure, lack of training in digital skills and inadequate government policies. These factors limit the ability of organizations to take full advantage of these innovations. The main conclusion highlights that overcoming these barriers requires strategic leadership, investment in technological infrastructure, continuous training and an innovation-oriented organizational culture. In addition, it is essential to design public policies that promote technological connectivity and reduce the digital divide. Finally, it is suggested that strategic alliances between companies, academic institutions and governments be fostered to share resources and knowledge, accelerating technological adoption and strengthening the competitiveness of organizations in the global digital environment. © 2025, Qubahan. All rights reserved.","Review","Final","All Open Access; Gold Open Access; Green Open Access","Scopus","2-s2.0-105027435939"
"Singh M.; Rao M.K.; Jogi S.S.; Pandey M.B.; Sao A.; Chopde M.","Singh, Mahesh (57855942100); Rao, Manoj Kumar (58814736000); Jogi, Surendra S. (58814933300); Pandey, Manoj B. (58814530200); Sao, Ajit (58820750000); Chopde, Mahesh (58814530300)","57855942100; 58814736000; 58814933300; 58814530200; 58820750000; 58814530300","Smart Marketing Investments: A Framework for AI-Based Financial Decision Support","2024","International Journal of Intelligent Systems and Applications in Engineering","12","17s","","88","100","1","","https://www.scopus.com/inward/record.uri?eid=2-s2.0-85186404662&partnerID=40&md5=b8ceb1bd31f2f54373a83dd16c9a53b1","The use of artificial intelligence (AI) has become an important part of smart marketing investments in the fast-paced world of business and banking. Using AI's critical skills to improve accuracy, lower risks, and make the best use of resources is a huge step forward in this framework. As the amount and variety of data grows, standard ways of making decisions often don't work. We need a new way of thinking that uses AI to get useful insights.AI is very important for helping people make financial decisions because it can predict things better than humans can. AI quickly looks at huge information to find patterns, predicts market trends, and gives businesses an edge when making decisions. Being able to predict the future not only helps with strategic planning, but it also helps lower risks. AI models look at both past data and real-time market signs using machine learning algorithms. This lets businesses plan ahead for volatile market conditions and improve their financial stability. The proposed framework necessity of improving marketing funds in a time when allocating resources wisely is very important. With the help of data-driven AI models,and machine learning method for marketing budgets are carefully directed toward outlets and projects that are most likely to bring back the most money. This detailed method makes things run more smoothly, so businesses can quickly adjust to changing market conditions and get the most out of their market ing campaigns. This paper study about the bigger effects of AI-based financial decision support in the digital age, focusing on how it encourages new ideas, flexibility, and adaptation with morden machine learning methods. As companies try to figure out how to operate in today's complicated markets, this approach is a complete way to use AI's changing power to make smart and useful marketing investments. © 2024, Ismail Saritas. All rights reserved.","Article","Final","","Scopus","2-s2.0-85186404662"
"Macdonald J.C.; Isom D.C.; Evans D.D.; Page K.J.","Macdonald, Judith C. (56548014300); Isom, David C. (57225264946); Evans, Daniel D. (57199095602); Page, Katy J. (36134682600)","56548014300; 57225264946; 57199095602; 36134682600","Digital Innovation in Medicinal Product Regulatory Submission, Review, and Approvals to Create a Dynamic Regulatory Ecosystem—Are We Ready for a Revolution?","2021","Frontiers in Medicine","8","","660808","","","30","10.3389/fmed.2021.660808","https://www.scopus.com/inward/record.uri?eid=2-s2.0-85107401584&doi=10.3389%2Ffmed.2021.660808&partnerID=40&md5=b03375362d30528c3244827fd901492f","The pace of scientific progress over the past several decades within the biological, drug development, and the digital realm has been remarkable. The’omics revolution has enabled a better understanding of the biological basis of disease, unlocking the possibility of new products such as gene and cell therapies which offer novel patient centric solutions. Innovative approaches to clinical trial designs promise greater efficiency, and in recent years, scientific collaborations, and consortia have been developing novel approaches to leverage new sources of evidence such as real-world data, patient experience data, and biomarker data. Alongside this there have been great strides in digital innovation. Cloud computing has become mainstream and the internet of things and blockchain technology have become a reality. These examples of transformation stand in sharp contrast to the current inefficient approach for regulatory submission, review, and approval of medicinal products. This process has not fundamentally changed since the beginning of medicine regulation in the late 1960s. Fortunately, progressive initiatives are emerging that will enrich and streamline regulatory decision making and deliver patient centric therapies, if they are successful in transforming the current transactional construct and harnessing scientific and technological advances. Such a radical transformation will not be simple for both regulatory authorities and company sponsors, nor will progress be linear. We examine the shortcomings of the current system with its entrenched and variable business processes, offer examples of progress as catalysts for change, and make the case for a new cloud based model. To optimize navigation toward this reality we identify implications and regulatory design questions which must be addressed. We conclude that a new model is possible and is slowly emerging through cumulative change initiatives that question, challenge, and redesign best practices, roles, and responsibilities, and that this must be combined with adaptation of behaviors and acquisition of new skills. © Copyright © 2021 Macdonald, Isom, Evans and Page.","Article","Final","All Open Access; Gold Open Access; Green Open Access","Scopus","2-s2.0-85107401584"
"Dermatis Z.; Dimitrios K.; Anastasiou A.","Dermatis, Zacharias (57190257568); Dimitrios, Komninos (57204964146); Anastasiou, Athanasios (55960974300)","57190257568; 57204964146; 55960974300","Pedagogical approaches using simulations to enhance learning outcomes in business education","2025","Integrating Simulation Tools Into Entrepreneurship Education","","","","141","160","0","10.4018/979-8-3693-9040-5.ch007","https://www.scopus.com/inward/record.uri?eid=2-s2.0-105004781050&doi=10.4018%2F979-8-3693-9040-5.ch007&partnerID=40&md5=840d5b34622f297c7fbe0a9a21128320","This chapter examines simulation tools in business education, showcasing their ability to bridge theory and practice while developing skills like problem-solving, decision-making, and teamwork. Rooted in experiential and collaborative learning, simulations enable students to engage in real-world scenarios. Tools such as the Business Strategy Game, SimVenture, and Markstrat demonstrate value in teaching strategic management, SME operations, and marketing strategies. Key benefits include active participation, realtime feedback, and adaptability, though challenges like costs, technical issues, and training requirements persist. The chapter highlights the need for curriculum integration, teacher training, and advanced technologies like AI and AR to fully utilize simulations. While not a universal solution, they effectively prepare students for the complexities of modern business education. © 2025 by IGI Global Scientific Publishing. All rights reserved.","Book chapter","Final","","Scopus","2-s2.0-105004781050"
