"Authors","Author full names","Author(s) ID","Title","Year","Source title","Volume","Issue","Art. No.","Page start","Page end","Cited by","DOI","Link","Abstract","Document Type","Publication Stage","Open Access","Source","EID"
"Arianpoor A.; Abdollahi A.","Arianpoor, Arash (57219163409); Abdollahi, Ahmad (56681443500)","57219163409; 56681443500","The interaction of accounting employability-based skills and problem-based learning","2025","Journal of Applied Accounting Research","","","","1","26","0","10.1108/JAAR-02-2025-0088","https://www.scopus.com/inward/record.uri?eid=2-s2.0-105025409653&doi=10.1108%2FJAAR-02-2025-0088&partnerID=40&md5=1b9050c0269249cc184b5b11b789674e","Purpose – This study aims to provide a framework for the interaction between accounting employability-based skills and problem-based learning (PBL). Design/methodology/approach – This study explored the views of 18 participants (11 accounting professors and seven board members) who were chosen as experts. This study collected data through two consecutive stages (i.e., interviews and questionnaires) in 2024. After summarizing the opinions of the six interviewees, the 31 accounting employability-based skills in interaction with PBL were classified into three groups: technical, soft, and social mobility skills. A questionnaire survey was conducted in the second stage of the study. The opinions of 18 accounting professors and board members of the firms were surveyed using the Delphi method. Findings – This study employed Kendall's Coefficient of Concordance (W) to assess agreement among 18 experts in ranking 31 accounting skills across three primary constructs: Technical Skills (TES), Soft Skills (SOK), and Social Skills (SMK). The results demonstrated a strong agreement among experts in prioritizing these skills. The Consensus Index (CI) values align with other reported model metrics, suggesting that respondents largely agreed on the relevance and clarity of the items within each construct. The results showed that soft skills such as adaptability; knowledge of different contexts; preparing for the unpredictable nature of the accounting field; adapting quickly to new tools, processes, and market conditions; maintaining their effectiveness in a dynamic environment; and engaging in discussions and presenting findings during PBL activities are among the top 10 skills. The other statistical analyses conducted in this study further supported these results. Research limitations/implications – Despite the valuable insights generated by this study, several limitations must be acknowledged. The study was conducted in a specific national and cultural context (e.g., within an emerging economy), which may limit the generalizability of the findings to other regions with different educational, economic, or regulatory environments. Future cross-country comparisons are recommended to enhance the external validity of these findings. Expert opinion was sought in this study. Specialists and professionals were selected for this study. However, because the combination of accounting skills and PBL is a relatively recent development in accounting, we were unable to confirm the effectiveness of PBL through interviews or questionnaires. In future studies, it would be beneficial to collect feedback from real users to determine the benefits of PBL in accounting as well as the specific circumstances in which it is effective. Although this study provides meaningful understanding, its small sample size (n = 18) restricts the generalizability of its findings to larger populations. The Delphi panel and survey respondents were primarily academic and professional stakeholders with accounting education experience. Although these insights are essential, the exclusion of students and recent graduates may limit the diversity of their perspectives on employability-related challenges and competencies. Although validated scales were employed for the TES, SOK, SMK, and PBL, the cross-sectional nature of the study limited the ability to draw causal inferences. Future studies should employ longitudinal research to track changes in employability skill development over time, particularly in response to curriculum redesigns or sustained PBL interventions. Moreover, as accounting employability is crucial in post-higher education, future studies should explore ways to translate more implications from “university” to the “accounting profession.” While PBL was conceptualized as a mediating construct, this study did not explore its multiple formats (e.g., case-based, simulation-based, and online PBL). These design variations may influence the acquisition of employability skills differently and merit separate investigation. Combining quantitative modeling with qualitative data, such as classroom observations, could offer deeper insights into how students internalize employability skills through PBL experiences. The study revealed that awareness of blockchain technology in accounting, especially in areas such as auditing and transaction verification (TES11), is among the top ten skills. Future research should explore how AI-driven or gamified PBL platforms influence skill acquisition and employability in response to increasing integration of AI into educational and accounting work environments. Practical implications – These findings offer critical insights to curriculum designers and educators. Accounting departments should restructure their learning environments to embed PBL not as a supplemental tool but as an integral design framework to nurture strategic thinking, self-regulated learning, and communication competencies. Institutions in emerging and developing economies, where employability gaps are often pronounced, can leverage PBL to contextualize global skill standards within local educational practices. By aligning skill development with real-world simulations and reflective learning, universities can equip students with the evolving demands for accounting roles. Universities can apply these results to revise their accounting education and teaching approaches to professional accountants, thereby enhancing their competitive edge and developing effective marketing plans, particularly for international accounting students. Employers and industry partners are encouraged to collaborate with academic institutions to co-design PBL modules that reflect workplace complexity. Managers should consider applicants' experience with applied learning models, such as PBL, as a strong predictor of workplace readiness, particularly in areas that require adaptive reasoning, critical problem-solving, and stakeholder engagement. Continuous upskilling initiatives within accounting firms can adopt PBL-based workshops to close the competency gap between the staff members. As board members' opinions were also considered in this study, their views on accounting employability-based skills were also considered. Accounting professors can strategise ways to enhance students' skills and create plans to facilitate the job search process for accounting students. National and institutional education policy frameworks should promote outcome-based learning standards that explicitly integrate employability and skill metrics into course assessment. Policymakers in higher education ministries may consider incentivizing curriculum redesign to support PBL strategies in professional programs such as accounting, finance, and auditing. Incorporating PBL into accounting education is shifting towards a hands-on learning environment. This study promotes interactive learning by addressing complicated practical problems and developing necessary skills in the accounting field. The aim was to produce skilled graduates who could apply their knowledge in real-world situations. This helps to meet the needs of the current workforce, which involves adjusting, creating, and collaborating. Originality/value – The combination of employability-based skills and PBL in accounting education forms a strong foundation for equipping graduates in the job market. There is currently a gap in that PBL may not cover all skills necessary for successful accounting employment. Therefore, this study examines the interaction between these two fields, which has not been explored previously. © 2025 Emerald Publishing Limited","Article","Article in press","","Scopus","2-s2.0-105025409653"
"Yoseph F.; Heikkilä M.","Yoseph, Fahed (57207114583); Heikkilä, Markku (15069504500)","57207114583; 15069504500","A new approach for association rules mining using computational and artificial intelligence","2020","Journal of Intelligent and Fuzzy Systems","39","5","","7233","7246","3","10.3233/JIFS-200707","https://www.scopus.com/inward/record.uri?eid=2-s2.0-85096966672&doi=10.3233%2FJIFS-200707&partnerID=40&md5=35d4e03e0d3b5eb11a976ce8ec8ca47c","Market Intelligence is knowledge extracted from numerous data sources, both internal and external, to provide a holistic view of the market and to support decision-making. Association Rules Mining provides powerful data mining techniques for identifying associations and co-occurrences in large databases. Market Basket Analysis (MBA) uses ARM to gain insights from heterogeneous consumer shopping patterns and examines the effects of marketing initiatives. As Artificial Intelligence (AI) more and more finds its way to marketing, it entails fundamental changes in the skills-set required by marketers. For MBA, AI provides important ways to improve both the outcomes of the market basket analysis and the performance of the analysis process. In this study we demonstrate the effects of AI on MBA by our proposed new MBA model where results of computational intelligence are used in data preprocessing, in market segmentation and in finding market trends. We show with point-of-sale (POS) data of a small, local retailer that our proposed 'Abo algorithm' MBA model increases mining performance/intelligence and extract important marketing insights to assess both demand dynamics and product popularity trends. Additionally, the results show how, as related to the 80/20 percent rule, 78% of revenue is derived 16% of the product assortment. © 2020 - IOS Press and the authors. All rights reserved.","Article","Final","All Open Access; Green Open Access","Scopus","2-s2.0-85096966672"
"Arora N.; Chakraborty I.; Nishimura Y.","Arora, Neeraj (56494263900); Chakraborty, Ishita (57225907526); Nishimura, Yohei (59506856000)","56494263900; 57225907526; 59506856000","AI–Human Hybrids for Marketing Research: Leveraging Large Language Models (LLMs) as Collaborators","2025","Journal of Marketing","89","2","","43","70","74","10.1177/00222429241276529","https://www.scopus.com/inward/record.uri?eid=2-s2.0-86000715011&doi=10.1177%2F00222429241276529&partnerID=40&md5=9cac366f77a0d692b52f14fe0ca85f2f","The authors’ central premise is that a human–LLM (large language model) hybrid approach leads to efficiency and effectiveness gains in the marketing research process. In qualitative research, they show that LLMs can assist in both data generation and analysis; LLMs effectively create sample characteristics, generate synthetic respondents, and conduct and moderate in-depth interviews. The AI–human hybrid generates information-rich, coherent data that surpasses human-only data in depth and insightfulness and matches human performance in data analysis tasks of generating themes and summaries. Evidence from expert judges shows that humans and LLMs possess complementary skills; the human–LLM hybrid outperforms its human-only or LLM-only counterpart. For quantitative research, the LLM correctly picks the answer direction and valence, with the quality of synthetic data significantly improving through few-shot learning and retrieval-augmented generation. The authors demonstrate the value of the AI–human hybrid by collaborating with a Fortune 500 food company and replicating a 2019 qualitative and quantitative study using GPT-4. For their empirical investigation, the authors design the system architecture and prompts to create personas, ask questions, and obtain responses from synthetic respondents. They provide road maps for integrating LLMs into qualitative and quantitative marketing research and conclude that LLMs serve as valuable collaborators in the insight generation process. © American Marketing Association 2025.","Article","Final","","Scopus","2-s2.0-86000715011"
"Rodriguez M.; Trainor K.J.","Rodriguez, Michael (55547114985); Trainor, Kevin J. (35101021300)","55547114985; 35101021300","INTEGRATING GENERATIVE ARTIFICIAL INTELLIGENCE (GEnAI) IN A PROFESSIONAL SELLING COURSE: APPLICATION OF PROMPT ENGINEERING","2025","Marketing Education Review","","","","","","2","10.1080/10528008.2025.2507682","https://www.scopus.com/inward/record.uri?eid=2-s2.0-105005762661&doi=10.1080%2F10528008.2025.2507682&partnerID=40&md5=92d9e42c5e36973c8805e0a2bfd515e2","As the adoption of Generative Artificial Intelligence (GenAI) gains momentum in both academic institutions and the business sector, the imperative for future sales professionals to harness technologies like ChatGPT is becoming increasingly pronounced within marketing curricula. This paper introduces an experiential learning innovation that empowers sales students to utilize GenAI effectively within the sales process, focusing on the nuanced art of “prompt engineering.” This technique involves crafting specific inputs to elicit desired outputs from an AI model, a skill vital for navigating the complexities of modern sales environments. The authors detail a structured experiential learning exercise, highlighting how students were tasked with refining their prompts to achieve more precise outcomes in several stages of the sales process. This hands-on approach not only bridges the Theory-Practice Gap by grounding students in both the theoretical underpinnings and practical applications of Generative AI but also underscores the relevance of generative AI in the marketing curriculum. We also employ Algorithmic and Data Dependency Theories in evaluating the role of GenAI in sales education. Participant feedback underscores significant gains in understanding and applying GenAI in sales, affirming the curriculum’s role in equipping a future-ready salesforce. The paper concludes with insights into the ongoing integration of GenAI into sales education, advocating for a curriculum that is both technologically advanced and practically oriented. © 2025 Society for Marketing Advances.","Article","Article in press","","Scopus","2-s2.0-105005762661"
"Narang U.; Sachdev V.; Liu R.","Narang, Unnati (57210604639); Sachdev, Vishal (36804684600); Liu, Ruichun (59773151100)","57210604639; 36804684600; 59773151100","When AI Wears Many Hats: The Role of Generative Artificial Intelligence in Marketing Education","2025","Journal of Public Policy and Marketing","44","3","","473","489","11","10.1177/07439156251328237","https://www.scopus.com/inward/record.uri?eid=2-s2.0-105004307254&doi=10.1177%2F07439156251328237&partnerID=40&md5=4c7554fe2da31b391757a489869219d3","Generative artificial intelligence (GAI) is increasingly being integrated into marketing education and is reshaping the skill sets required in marketing careers. While research has highlighted the promise and perils of incorporating GAI into education, there remains a need for a comprehensive framework to guide its effective use. In this research, the authors conduct a multipronged analysis, including a review of marketing course syllabi, a survey of marketing educators, and follow-up qualitative interviews. Building on role theory and the community of inquiry model, they propose that GAI can assume three roles in marketing education: tutor, teammate, and tool. Each role influences teaching, social, and cognitive presence differently, shaping the learning experience and preparing workplace-ready marketing graduates. For instance, as a tutor, GAI can aid students in grasping theoretical concepts, while as a teammate, it can foster collaboration by supporting brainstorming and problem-solving activities. However, ethical considerations such as data privacy, plagiarism, dependency on AI, and fairness in assessment must be addressed to ensure its responsible adoption in marketing education. The authors provide concrete examples for GAI's careful integration in marketing courses and discuss its implications for marketing educators, learners, and policy makers. © American Marketing Association 2025.","Article","Final","","Scopus","2-s2.0-105004307254"
"Indravathy K.; Rahim N.A.","Indravathy, K. (59329815200); Rahim, Noorlizawati Abd (57211391204)","59329815200; 57211391204","EMERGING AMBIDEXTROUS OPPORTUNITIES: HOW MALAYSIAN GLCS CAN LEVERAGE ARTIFICIAL INTELLIGENCE","2024","Journal of Theoretical and Applied Information Technology","102","16","","6038","6061","6","","https://www.scopus.com/inward/record.uri?eid=2-s2.0-85204111598&partnerID=40&md5=0a1b4220bb01032acb12df28a08e7963","Government-linked companies (GLCs) are integral to Malaysia's economic growth, operating under substantial government ownership and control across various sectors. In the digital era, it is crucial for GLCs to adopt advanced technologies, particularly artificial intelligence (AI), to enhance their performance and remain competitive against non-GLCs. This study investigates the role of AI in GLCs to provide ambidextrous opportunities, addressing the research gap focused on AI adoption and potential impact in Malaysian GLCs. A Systematic Literature Review (SLR) was conducted using the PRISMA method to analyze 48 peer-reviewed articles from the Web of Science (WOS) and Scopus databases, published between 2013 and 2024. The results revealed various roles of AI that can be leveraged by GLCs as ambidextrous opportunities, including automating financial tasks and services, enhancing transparency in procurement, optimizing supply chain resources, improving public administration, strengthening policy governance, optimizing marketing efforts, enhancing human resource management, boosting corporate readiness, optimizing energy management, managing sustainable natural resources, revolutionizing healthcare, implementing smart farming, enhancing e-commerce strategies, optimizing renewable energy utilization, enhancing smart grid management, increasing organizational agility, developing managerial skills, enhancing product development, and improving manufacturing efficiency. The study provides managerial recommendations for integrating AI across various sectors, aiming to boost competitiveness, operational efficiency, and innovation. This research contributes to the literature by offering practical insights and strategic guidance for policymakers and managers in leveraging AI to create ambidextrous opportunities, ensuring sustained growth and competitiveness in the digital age. This study recommends future research focus on the issues and challenges of leveraging AI in GLCs. © Little Lion Scientific.","Article","Final","","Scopus","2-s2.0-85204111598"
"AlRoshoud A.N.; El-Gohary H.O.","AlRoshoud, Abdullah Nabeel (59452360100); El-Gohary, Hatem Osman (54399994100)","59452360100; 54399994100","Exploring the Impact of Combining Neuromarketing and AI Adoption on the Perceived Effectiveness of Social Media Advertising Campaigns: An Overview of the Literature and a Proposed Framework","2024","International Journal of Customer Relationship Marketing and Management","15","1","","","","2","10.4018/IJCRMM.361975","https://www.scopus.com/inward/record.uri?eid=2-s2.0-85211745579&doi=10.4018%2FIJCRMM.361975&partnerID=40&md5=6ed02e94c0879145c6219b9e5e3af54d","Literature shows that integrating advanced tech-oriented marketing skills and techniques (i.e., Neuromarketing and Artificial Intelligence concepts) and assessing that influence toward incentivizing SMEs owners to outsource their marketing activities are still omitted and need further clarifications. As a response, through a deep exploration of the literature and insights from the related Key Performance Indicators (KPIs), this research articulates a proposed research framework, upon the premise of extending Taylor and Todd’s Decomposed Theory of Planned Behavior. This research seeks to contribute by presenting a framework that further allows M&A agencies to comprehend the underpinnings of integrating such a tech-oriented combination toward enhancing their performance while crafting advertising campaigns for SMEs. This is along with showing how such integration would improve the image of those M&A agencies showing their superb capabilities in crafting advertising campaigns. The authors believe the framework is expected to serve as a guideline for future researchers to incorporate their primary data towards framing their research. © 2024 IGI Global. All rights reserved.","Article","Final","All Open Access; Gold Open Access; Green Open Access","Scopus","2-s2.0-85211745579"
"Semwal R.; Ranjan S.; Dhama A.; Chauhan A.; Bairwa M.K.; Madhav R.C.","Semwal, Rajeev (6603721049); Ranjan, Shiv (57222469494); Dhama, Aditi (57258443400); Chauhan, Anubhav (58890344500); Bairwa, Mahesh Kumar (58890358700); Madhav, Rupesh Chandra (58890358300)","6603721049; 57222469494; 57258443400; 58890344500; 58890358700; 58890358300","Conceptual Framework: Leveraging Artificial Intelligence for Enhanced Travel Review Analysis and Insights","2023","Proceedings of International Conference on Contemporary Computing and Informatics, IC3I 2023","","","","2176","2181","3","10.1109/IC3I59117.2023.10397763","https://www.scopus.com/inward/record.uri?eid=2-s2.0-85185228162&doi=10.1109%2FIC3I59117.2023.10397763&partnerID=40&md5=c26e2a5033ed4eee41803876040e3a20","This study proposes an AI-based paradigm for travel review analysis. Travel reviews influence customer choices and the tourist business. The framework includes data collection and preprocessing, sentiment analysis, feature extraction and topic modeling, deep learning, and insight production. Data collection and preparation provide diversified, high-quality trip review data for analysis. Sentiment analysis and opinion mining classify reviews to determine travelers happiness. Feature extraction and topic modeling reveal traveler preferences and interests by extracting keywords, topics, and features from reviews. Deep learning methods like CNN and LSTM networks capture complicated travel review structures and dependencies, improving sentiment analysis and opinion mining. These methods help contextualize passengers feelings and preferences throughout time. The proposed approach yields travel industry-wide information. They assist in data-driven decision-making, personalized suggestions, destination marketing and management strategies, service quality, market research and competitive analysis, and product creation. AI travel review analysis presents obstacles and considerations. These include data quality and availability, privacy and ethical considerations, bias mitigation and fairness, interpretability and explainability, technical skills and resources, user acceptability and adoption, and continual learning. By adopting the proposed conceptual framework and overcoming the obstacles, travel companies can gain deeper insights from travel reviews, improve customer experiences, and make informed decisions to stay competitive in the dynamic and growing travel market. Travel review analysis, artificial intelligence, conceptual framework, sentiment analysis, opinion mining, deep learning, data collection, preprocessing, feature extraction, topic modeling, insights generation, decision-making, personalized recommendations, destination marketing.  © 2023 IEEE.","Conference paper","Final","","Scopus","2-s2.0-85185228162"
"Yordanova Z.","Yordanova, Zornitsa (57200724991)","57200724991","Emotion-Driven Marketing Education With AI Sentiment Analysis","2025","Improving Consumer Engagement in Digital Marketing Through Cognitive AI","","","","99","114","0","10.4018/979-8-3373-3775-3.ch005","https://www.scopus.com/inward/record.uri?eid=2-s2.0-105022765825&doi=10.4018%2F979-8-3373-3775-3.ch005&partnerID=40&md5=c56e3b1270c8b81e064bb22896ed31c7","This research designs and implements an AI-based educational system for sentiment analysis in marketing texts. The system uses advanced natural language processing models such as BERT and LSTM to identify consumer sentiment and provide students with real-time feedback. The goal of this system is to improve students' sentiment analysis skills and gain a deeper understanding of consumer behavior. The results showed that this system helped improve students' analytical skills and provided them with an interactive and effective learning experience. This system can be used as an effective tool in marketing education. © 2026, IGI Global Scientific Publishing. All rights reserved.","Book chapter","Final","","Scopus","2-s2.0-105022765825"
